{
	"name": "PluginSelect",
	"id": "owo.Nytra.PluginSelect",
	"description": "Adds some extra UI to the \"Start Custom Session\" dialog to allow you to select which data model plugins to use for that session.",
	"category": "Plugins",
	"sourceLocation": "https://github.com/Nytra/ResonitePluginSelect",
	"versions": {
		"1.0.1": {
			"releaseUrl": "https://github.com/Nytra/ResonitePluginSelect/releases/tag/v1.0.1",
			"artifacts": [{
				"url": "https://github.com/Nytra/ResonitePluginSelect/releases/download/v1.0.1/PluginSelect.dll",
				"sha256": "a8d2b95c9950e3d08595573bb52aa5d307536aab13bac23cd1ba61f923b149f1",
				"installLocation": "/rml_mods"
			}]
		},
		"1.0.2": {
			"releaseUrl": "https://github.com/Nytra/ResonitePluginSelect/releases/tag/v1.0.2",
			"artifacts": [{
				"url": "https://github.com/Nytra/ResonitePluginSelect/releases/download/v1.0.2/PluginSelect.dll",
				"sha256": "984e2281b5dac29967a0ba5aabc2e25cb83e406150bb486bd64487eef7c9980a",
				"installLocation": "/rml_mods"
			}]
		}
	}
}
