{
	"name": "IgnoreControllerAxis",
	"id": "ErrorJan.IgnoreControllerAxis",
	"description": "Make some joystick axis' not react at all or add a custom per axis deadzone.",
	"category": "Controls",
	"sourceLocation": "https://github.com/ErrorJan/ResoniteMod-IgnoreControllerAxis",
	"versions": {
		"1.0.0": {
			"releaseUrl": "https://github.com/ErrorJan/ResoniteMod-IgnoreControllerAxis/releases/tag/1.0.0",
			"artifacts": [{
				"url": "https://github.com/ErrorJan/ResoniteMod-IgnoreControllerAxis/releases/download/1.0.0/IgnoreControllerAxis.dll",
				"sha256": "a4f43339b5bad47d7c53a1e22ba1d6d3791faa8201dfcbce1485e3ca4e43f562"
			}]
		}
	}
}