{
    "name": "ShowDelegates",
    "id": "me.art0007i.ShowDelegates",
    "description": "Shows delegates and hidden items in the inspector panel",
    "category": "Inspectors",
    "sourceLocation": "https://github.com/art0007i/ShowDelegates",
    "versions": {
        "2.2.4": {
            "releaseUrl": "https://github.com/art0007i/ShowDelegates/releases/tag/2.2.4",
            "artifacts": [
                {
                    "url": "https://github.com/art0007i/ShowDelegates/releases/download/2.2.4/ShowDelegates.dll",
                    "filename": "ShowDelegates.dll",
                    "sha256": "b15f241bb31378077cf76c03f5cbdab6f882cad19d0738cc981c91e9be546aac"
                }
            ]
        },
        "2.2.5": {
            "releaseUrl": "https://github.com/art0007i/ShowDelegates/releases/tag/2.2.5",
            "artifacts": [
                {
                    "url": "https://github.com/art0007i/ShowDelegates/releases/download/2.2.5/ShowDelegates.dll",
                    "filename": "ShowDelegates.dll",
                    "sha256": "ec2460b109f04c62045c0b537cf50b1e545b72f3aabb6f5e2a3b2320d1b55316"
                }
            ],
            "changelog": "Fix issue where some delegates were not showing up (#7)"
        },
        "2.2.6": {
            "releaseUrl": "https://github.com/art0007i/ShowDelegates/releases/tag/2.2.6",
            "artifacts": [
                {
                    "url": "https://github.com/art0007i/ShowDelegates/releases/download/2.2.6/ShowDelegates.dll",
                    "filename": "ShowDelegates.dll",
                    "sha256": "3126895a622ae75bed335d5fe6ee2d1d9ecb4a13179791211464c4f5e4cd85a4"
                }
            ],
            "changelog": "Rebuilt for new resonite version"
        },
        "2.2.7": {
            "releaseUrl": "https://github.com/art0007i/ShowDelegates/releases/tag/2.2.7",
            "artifacts": [
                {
                    "url": "https://github.com/art0007i/ShowDelegates/releases/download/2.2.7/ShowDelegates.dll",
                    "filename": "ShowDelegates.dll",
                    "sha256": "3a13bb871d3957bc0a0d956494e8805e9e0686a8233a82bb15a4f7b82d4a0846"
                }
            ],
            "changelog": "Fixed the mod not working in the latest version"
        },
        "2.2.8": {
            "releaseUrl": "https://github.com/art0007i/ShowDelegates/releases/tag/2.2.8",
            "artifacts": [
                {
                    "url": "https://github.com/art0007i/ShowDelegates/releases/download/2.2.8/ShowDelegates.dll",
                    "filename": "ShowDelegates.dll",
                    "sha256": "489ccc8326e7b5404be15d874da950772180b3a220bbebcd9cc555079e3041c7"
                }
            ]
        },
        "2.2.9": {
            "releaseUrl": "https://github.com/art0007i/ShowDelegates/releases/tag/2.2.9",
            "artifacts": [
                {
                    "url": "https://github.com/art0007i/ShowDelegates/releases/download/2.2.9/ShowDelegates.dll",
                    "filename": "ShowDelegates.dll",
                    "sha256": "420341da08088da831d17d48db53efaf988480820554e52914b69bc4001637d8"
                }
            ],
            "changelog": "Add a few delegates to the lookup table"
        },
        "2.2.10": {
            "releaseUrl": "https://github.com/art0007i/ShowDelegates/releases/tag/2.2.10",
            "artifacts": [
                {
                    "url": "https://github.com/art0007i/ShowDelegates/releases/download/2.2.10/ShowDelegates.dll",
                    "filename": "ShowDelegates.dll",
                    "sha256": "b35b1a6893617c3cdf5a976c99f4d8a17f1770cfe6e8136515043c91f908afa2"
                }
            ],
            "changelog": "Fix for splittening"
        },
        "2.2.11": {
            "releaseUrl": "https://github.com/art0007i/ShowDelegates/releases/tag/2.2.11",
            "artifacts": [
                {
                    "url": "https://github.com/art0007i/ShowDelegates/releases/download/2.2.11/ShowDelegates.dll",
                    "sha256": "8aebd1cf051c235f43bad2cd902099e46c194dfd097729267b70cc9fcf0d48d4"
                }
            ],
            "changelog": "Gracefully handle errors when the type stored in the sync method attribute is wrong"
        }
    }
}