{
	"name": "ViveStreamingFaceTrackingForResonite",
	"id": "com.nekometer.esnya.ViveStreamingFaceTracking",
	"description": "Adds facial tracking using Vive Hub for HMDs such as Vive Focus 3, Vive XR Elite, and Vive Focus Vision.",
	"category": "Hardware Integration",
	"sourceLocation": "https://github.com/esnya/ViveStreamingFaceTrackingForResonite",
	"additionalAuthors": [
		"howardhuanghtc",
		"JLhtc"
	],
	"tags": [
		"eyes",
		"lips",
		"eye tracking",
		"vive streaming"
	],
	"versions": {
		"0.1.2": {
			"releaseUrl": "https://github.com/esnya/ViveStreamingFaceTrackingForResonite/releases/tag/v0.1.2.0",
			"artifacts": [{
				"url": "https://github.com/esnya/ViveStreamingFaceTrackingForResonite/releases/download/v0.1.2.0/ViveStreamingFaceTracking.dll",
				"sha256": "a27e423b3f6fec38a8f89979108176641bef31dfedf39c0771ba1364dc6b0c89"
			}]
		},
		"0.1.1": {
			"releaseUrl": "https://github.com/esnya/ViveStreamingFaceTrackingForResonite/releases/tag/v0.1.1.0",
			"artifacts": [{
				"url": "https://github.com/esnya/ViveStreamingFaceTrackingForResonite/releases/download/v0.1.1.0/ViveStreamingFaceTracking.dll",
				"sha256": "45b222ea4f2cc66e1125b4a31d6f389bc51f9ce398062b07c30fdd4f351a49b1"
			}]
		}
	}
}
