{
    "name": "OutOfSightOverride",
    "id": "me.art0007i.OutOfSightOverride",
    "description": "Ignores the out of sight check on buttons",
    "category": "Misc",
    "sourceLocation": "https://github.com/art0007i/OutOfSightOverride",
    "versions": {
        "1.0.0": {
            "releaseUrl": "https://github.com/art0007i/OutOfSightOverride/releases/tag/1.0.0",
            "artifacts": [
                {
                    "url": "https://github.com/art0007i/OutOfSightOverride/releases/download/1.0.0/OutOfSightOverride.dll",
                    "filename": "OutOfSightOverride.dll",
                    "sha256": "c7fef55525aa9bbcb96c42aa4271707497fd3f0466cb17f1bc1c37e907544c75"
                }
            ]
        }
    }
}