{
	"name": "ContextMenuBackOption",
	"id": "dog.glacier.ContextMenuBackOption",
	"description": "Adds a Back option to every Context Menu submenu.",
	"category": "Context Menu",
	"sourceLocation": "https://github.com/noblereign/ResoniteContextMenuBackOption",
	"versions": {
		"4.0.1": {
			"releaseUrl": "https://github.com/noblereign/ResoniteContextMenuBackOption/releases/tag/v4.0.1",
			"artifacts": [{
				"url": "https://github.com/noblereign/ResoniteContextMenuBackOption/releases/download/v4.0.1/ContextMenuBackOption.dll",
				"sha256": "16ec7ae67017f9bb9d46c525195cf6e66eeef3e21e6ee570125b229b4e58f23a"
			}]
		},
		"4.0.0": {
			"releaseUrl": "https://github.com/noblereign/ResoniteContextMenuBackOption/releases/tag/v4.0.0",
			"artifacts": [{
				"url": "https://github.com/noblereign/ResoniteContextMenuBackOption/releases/download/v4.0.0/ContextMenuBackOption.dll",
				"sha256": "4399a5ac5d8bec18e7f434ac298dc6ec4fcde387dd83960943abd4529c365e97"
			}]
		},
		"3.0.0": {
			"releaseUrl": "https://github.com/noblereign/ResoniteContextMenuBackOption/releases/tag/v3.0.0",
			"artifacts": [{
				"url": "https://github.com/noblereign/ResoniteContextMenuBackOption/releases/download/v3.0.0/ContextMenuBackOption.dll",
				"sha256": "58f89b02e7256bb70cd9088c77d9a81497f774c7b62aadd6875e89682b9292c1"
			}]
		},
		"2.3.2": {
			"releaseUrl": "https://github.com/noblereign/ResoniteContextMenuBackOption/releases/tag/v2.3.2",
			"artifacts": [{
				"url": "https://github.com/noblereign/ResoniteContextMenuBackOption/releases/download/v2.3.2/ContextMenuBackOption.dll",
				"sha256": "7ec3573545d5c788d7780b9a4b9aabb2750c8c300e8d059e0c57b16d196b12b7"
			}]
		},
		"2.3.1": {
			"releaseUrl": "https://github.com/noblereign/ResoniteContextMenuBackOption/releases/tag/v2.3.1",
			"artifacts": [{
				"url": "https://github.com/noblereign/ResoniteContextMenuBackOption/releases/download/v2.3.1/ContextMenuBackOption.dll",
				"sha256": "03adece33f50bf5425498f3397d9c80c7c18ae254ce7b8c614291e030dfe59b2"
			}]
		},
		"2.3.0": {
			"releaseUrl": "https://github.com/noblereign/ResoniteContextMenuBackOption/releases/tag/v2.3.0",
			"artifacts": [{
				"url": "https://github.com/noblereign/ResoniteContextMenuBackOption/releases/download/v2.3.0/ContextMenuBackOption.dll",
				"sha256": "b8d2b4ec03eabbf720c59c0388b0df2e65666861f34a8bfc557aca6b3283d4a0"
			}]
		}
	}
}