{
  "name": "Resdb Tools",
  "id": "cat.colin.ResdbTools",
  "description": "Extends the inventory browser with tools to get and modify Resonite database records.",
  "category": "Dashboard",
  "sourceLocation": "https://forge.colintimbarndt.de/Colin/resonite-resdb-tools-mod",
  "tags": ["inventory", "resdb", "database", "cloud"],
  "versions": {
    "1.0.1": {
      "releaseUrl": "https://forge.colintimbarndt.de/Colin/resonite-resdb-tools-mod/releases/tag/v1.0.1",
      "artifacts": [
        {
          "url": "hhttps://forge.colintimbarndt.de/Colin/resonite-resdb-tools-mod/releases/download/v1.0.1/ResdbTools.dll",
          "sha256": "67361a23583e499e5bc4236303c43df7e533a3fdce4bd958769caa0e677fa977"
        }
      ],
      "changelog": "Initial RML release."
    }
  }
}
