{
	"name": "ResoTabbed",
	"id": "net.NepuShiro.ResoTabbed",
	"description": "Adds a Dynamic Variable to show when you're tabbed in or not",
	"category": "Misc",
	"sourceLocation": "https://github.com/NepuShiro/ResoTabbed",
	"versions": {
		"1.0.0": {
			"releaseUrl": "https://github.com/NepuShiro/ResoTabbed/releases/tag/1.0.0",
			"artifacts": [{
				"url": "https://github.com/NepuShiro/ResoTabbed/releases/download/1.0.0/ResoTabbed.dll",
				"sha256": "da445cd6a06ef9e443cb8474bcc72a898d4984f39b421cf8161128f41b9ae9c5"
			}]
		}
	}
}