{
	"name": "SlotInspectorHighlighter",
	"id": "com.Sinduy.SlotInspectorHighlighter",
	"description": "Adds a highlight to the hierarchy interface in the inspector to show which slot is currently being selected.",
	"category": "Inspectors",
	"sourceLocation": "https://github.com/sjsanjsrh/SlotInspectorHighlighter",
	"versions": {
		"1.0.6": {
			"releaseUrl": "https://github.com/sjsanjsrh/SlotInspectorHighlighter/releases/tag/1.0.6",
			"artifacts": [{
				"url": "https://github.com/sjsanjsrh/SlotInspectorHighlighter/releases/download/1.0.6/SlotInspectorHighlighter.dll",
				"filename": "SlotInspectorHighlighter.dll",
				"sha256": "13b11885bf65be1f6758f635c08ad645ae03e3fda13c109b93741d7c2bd29abd"
			}]
		},
		"1.0.3": {
			"releaseUrl": "https://github.com/sjsanjsrh/SlotInspectorHighlighter/releases/tag/v1.0.3",
			"artifacts": [{
				"url": "https://github.com/sjsanjsrh/SlotInspectorHighlighter/releases/download/v1.0.3/SlotInspectorHighlighter.dll",
				"sha256": "be997ad763dd2652d8f7f8dc7a609b80bc4b90dc81a98dd2c2fd8a486dae67ee"
			}]
		},
		"1.0.2": {
			"releaseUrl": "https://github.com/sjsanjsrh/SlotInspectorHighlighter/releases/tag/v1.0.2",
			"artifacts": [{
				"url": "https://github.com/sjsanjsrh/SlotInspectorHighlighter/releases/download/v1.0.2/SlotInspectorHighlighter.dll",
				"sha256": "cfe80b912f859e31b16c8273c6585098c91d75b4dc5ce74d20a372fe5cda7675"
			}]
		},
		"1.0.1": {
			"releaseUrl": "https://github.com/sjsanjsrh/SlotInspectorHighlighter/releases/tag/v1.0.1",
			"artifacts": [{
				"url": "https://github.com/sjsanjsrh/SlotInspectorHighlighter/releases/download/v1.0.1/SlotInspectorHighlighter.dll",
				"filename": "SlotInspectorHighlighter.dll",
				"sha256": "a0a2f0cf0586adf224a94b20f4f9f8afd317990521db632d04ced4a22cd2b8d3"
			}]
		},
		"1.0.0": {
			"releaseUrl": "https://github.com/sjsanjsrh/SlotInspectorHighlighter/releases/tag/v1.0.0",
			"artifacts": [{
				"url": "https://github.com/sjsanjsrh/SlotInspectorHighlighter/releases/download/v1.0.0/SlotInspectorHighlighter.dll",
				"filename": "SlotInspectorHighlighter.dll",
				"sha256": "5a263595f9412ffc7fab7c535590a1e9444197c41777f6f3ff463862596ce65c"
			}]
		}
	}
}
