{
	"name": "Lognt",
	"id": "net.raidriar796.lognt",
	"description": "Allows for disabling all logs, warnings, and errors from being written to disk.",
	"category": "Technical Tweaks",
	"sourceLocation": "https://github.com/Raidriar796/Lognt",
	"versions": {
		"1.1.1": {
			"releaseUrl": "https://github.com/Raidriar796/Lognt/releases/tag/1.1.1",
			"artifacts": [
				{
					"url": "https://github.com/Raidriar796/Lognt/releases/download/1.1.1/Lognt.dll",
					"filename": "Lognt.dll",
					"sha256": "1E0C52BBFB47C82EAB7625C6CE37F4899D5CA192429E1C4049120484FC66FDFA"
				}
			]
		},
		"1.1.0": {
			"releaseUrl": "https://github.com/Raidriar796/Lognt/releases/tag/1.1.0",
			"artifacts": [
				{
					"url": "https://github.com/Raidriar796/Lognt/releases/download/1.1.0/Lognt.dll",
					"filename": "Lognt.dll",
					"sha256": "0C2B00AAED7FA050040B62CB534AA9DA4DC26A862590507E5549D6FE85836FEE"
				}
			]
		},
		"1.0.0": {
			"releaseUrl": "https://github.com/Raidriar796/Lognt/releases/tag/1.0.0",
			"artifacts": [
				{
					"url": "https://github.com/Raidriar796/Lognt/releases/download/1.0.0/Lognt.dll",
					"filename": "Lognt.dll",
					"sha256": "1F69BE8F97EEBB89F7C86286E3540966D176F160AB3D91003C8DF9BB96C2F81A"
				}
			]
		}
	}
}
