{
	"name": "DoNotRunAwaySceneInspecter",
	"id": "com.Sinduy.DoNotRunAwaySceneInspecter",
	"description": "This mod prevents the scene inspector from moving away form user when they are trying to inspect a scene.",
	"category": "Inspectors",
	"sourceLocation": "https://github.com/sjsanjsrh/DoNotRunAwaySceneInspecter",
	"versions": {
		"1.0.5": {
			"releaseUrl": "https://github.com/sjsanjsrh/DoNotRunAwaySceneInspecter/releases/tag/1.0.5",
			"artifacts": [{
				"url": "https://github.com/sjsanjsrh/DoNotRunAwaySceneInspecter/releases/download/1.0.5/DoNotRunAwaySceneInspecter.dll",
				"filename": "DoNotRunAwaySceneInspecter.dll",
				"sha256": "ec022ba693587dfc67773e226295ab5d79418cb4384c3930492b72e2e89b4812"
			}]
		},
		"1.0.1": {
			"releaseUrl": "https://github.com/sjsanjsrh/DoNotRunAwaySceneInspecter/releases/tag/v1.0.1",
			"artifacts": [{
				"url": "https://github.com/sjsanjsrh/DoNotRunAwaySceneInspecter/releases/download/v1.0.1/DoNotRunAwaySceneInspecter.dll",
				"filename": "DoNotRunAwaySceneInspecter.dll",
				"sha256": "a6c9c20c62661331bbd994a1d9749bb2bd2225d4dc1568b49695da8aece9812a"
			}]
		},
		"1.0.0": {
			"releaseUrl": "https://github.com/sjsanjsrh/DoNotRunAwaySceneInspecter/releases/tag/v1.0.0",
			"artifacts": [{
				"url": "https://github.com/sjsanjsrh/DoNotRunAwaySceneInspecter/releases/download/v1.0.0/DoNotRunAwaySceneInspecter.dll",
				"filename": "DoNotRunAwaySceneInspecter.dll",
				"sha256": "a2ee76df5361933db30e812d3fad60998409eba2dc14dfbf5dfca0d52ac6e0cf"
			}]
		}
	}
}