{
	"name": "FixGrabWorld",
	"id": "ErrorJan.FixGrabWorld",
	"description": "This mod fixes the weird jump when you try using the GrabWorldLocomotion.",
	"category": "Bug Workaround",
	"sourceLocation": "https://github.com/ErrorJan/ResoniteMod-FixGrabWorld",
	"versions": {
		"1.0.0": {
			"releaseUrl": "https://github.com/ErrorJan/ResoniteMod-FixGrabWorld/releases/tag/1.0.0",
			"artifacts": [
				{
					"url": "https://github.com/ErrorJan/ResoniteMod-FixGrabWorld/releases/download/1.0.0/FixGrabWorld.dll",
					"sha256": "ce2c7fd0a214ce856844f45dad6637d777ebb7525bda9822f9baf4fc47c5f809"
				}
			]
		}
	}
}